{
  "schema_version": "vulnevidenceops.case-bundle.v1",
  "case_id": "CASE-SYNTH-001",
  "finding": {
    "schema_version": "vulnevidenceops.vulnerability-finding.v1",
    "finding_id": "FIND-SYNTH-001",
    "asset_ref": "synthetic-asset:web-001",
    "source_ref": "synthetic-scanner:reference-v1",
    "title": "Synthetic input-validation weakness",
    "severity": "high",
    "first_observed_at": "2026-01-01T00:00:00Z",
    "technical_identifiers": ["CVE-2099-0001", "CWE-79"],
    "evidence_refs": ["EVD-SYNTH-OBS-001"]
  },
  "evidence_catalog": [
    {
      "schema_version": "vulnevidenceops.evidence-reference.v1",
      "evidence_id": "EVD-SYNTH-OBS-001",
      "artifact_ref": "synthetic://scanner/observation-001.json",
      "artifact_sha256": "aaaaaaaaaaaaaaaaaaaaaaaaaaaaaaaaaaaaaaaaaaaaaaaaaaaaaaaaaaaaaaaa",
      "media_type": "application/json",
      "collected_at": "2026-01-01T00:00:00Z",
      "source_identity": "synthetic-scanner:reference-v1",
      "synthetic": true
    },
    {
      "schema_version": "vulnevidenceops.evidence-reference.v1",
      "evidence_id": "EVD-SYNTH-TRI-001",
      "artifact_ref": "synthetic://ticket/triage-001.json",
      "artifact_sha256": "bbbbbbbbbbbbbbbbbbbbbbbbbbbbbbbbbbbbbbbbbbbbbbbbbbbbbbbbbbbbbbbb",
      "media_type": "application/json",
      "collected_at": "2026-01-02T00:00:00Z",
      "source_identity": "synthetic-ticket:reference-v1",
      "synthetic": true
    },
    {
      "schema_version": "vulnevidenceops.evidence-reference.v1",
      "evidence_id": "EVD-SYNTH-REM-001",
      "artifact_ref": "synthetic://change/change-001.json",
      "artifact_sha256": "cccccccccccccccccccccccccccccccccccccccccccccccccccccccccccccccc",
      "media_type": "application/json",
      "collected_at": "2026-01-03T00:00:00Z",
      "source_identity": "synthetic-change:reference-v1",
      "synthetic": true
    },
    {
      "schema_version": "vulnevidenceops.evidence-reference.v1",
      "evidence_id": "EVD-SYNTH-VER-001",
      "artifact_ref": "synthetic://scanner/retest-001.json",
      "artifact_sha256": "dddddddddddddddddddddddddddddddddddddddddddddddddddddddddddddddd",
      "media_type": "application/json",
      "collected_at": "2026-01-16T00:00:00Z",
      "source_identity": "synthetic-scanner:reference-v1",
      "synthetic": true
    }
  ],
  "triage": {
    "schema_version": "vulnevidenceops.triage-decision.v1",
    "decision_id": "TRI-SYNTH-001",
    "finding_id": "FIND-SYNTH-001",
    "decided_at": "2026-01-02T00:00:00Z",
    "accountable_role": "synthetic-vulnerability-owner",
    "disposition": "confirmed",
    "rationale": "Synthetic evidence confirms the reference finding.",
    "evidence_refs": ["EVD-SYNTH-TRI-001"]
  },
  "remediation": {
    "schema_version": "vulnevidenceops.remediation-record.v1",
    "remediation_id": "REM-SYNTH-001",
    "finding_id": "FIND-SYNTH-001",
    "owner_role": "synthetic-service-owner",
    "planned_at": "2026-01-03T00:00:00Z",
    "due_at": "2026-01-15T00:00:00Z",
    "action": "Apply the synthetic input-validation remediation.",
    "change_ref": "synthetic-change:CHG-001",
    "evidence_refs": ["EVD-SYNTH-REM-001"]
  },
  "verification": {
    "schema_version": "vulnevidenceops.verification-record.v1",
    "verification_id": "VER-SYNTH-001",
    "finding_id": "FIND-SYNTH-001",
    "performed_at": "2026-01-16T00:00:00Z",
    "verifier_role": "synthetic-independent-assurance",
    "outcome": "effective",
    "method": "Repeat the synthetic scanner observation and compare the expected result.",
    "evidence_refs": ["EVD-SYNTH-VER-001"]
  }
}
